<?xml version="1.0" encoding="UTF-8"?>
<!DOCTYPE cesAna SYSTEM "xcesAnaIPI.dtd">
<cesAna xmlns:xlink="http://www.w3.org/1999/xlink" version="1.0" type="lex disamb">
<chunkList>
 <chunk>
  <chunk type="s">
   <tok>
    <orth>Rodzina</orth>
    <lex><base>rodzina</base><ctag>subst:sg:nom:f</ctag></lex>
   </tok>
   <tok>
    <orth>pingwinów</orth>
    <lex><base>pingwin</base><ctag>subst:pl:gen:m2</ctag></lex>
   </tok>
   <tok>
    <orth>obejmuje</orth>
    <lex><base>obejmować</base><ctag>fin:sg:ter:imperf</ctag></lex>
   </tok>
   <tok>
    <orth>gatunki</orth>
    <lex><base>gatunek</base><ctag>subst:pl:nom:m3</ctag></lex>
    <lex><base>gatunek</base><ctag>subst:pl:acc:m3</ctag></lex>
    <lex><base>gatunek</base><ctag>subst:pl:voc:m3</ctag></lex>
   </tok>
   <tok>
    <orth>morskie</orth>
    <lex><base>morski</base><ctag>adj:sg:nom:n:pos</ctag></lex>
    <lex><base>morski</base><ctag>adj:sg:acc:n:pos</ctag></lex>
    <lex><base>morski</base><ctag>adj:sg:voc:n:pos</ctag></lex>
    <lex><base>morski</base><ctag>adj:pl:nom:m2:pos</ctag></lex>
    <lex><base>morski</base><ctag>adj:pl:acc:m2:pos</ctag></lex>
    <lex><base>morski</base><ctag>adj:pl:voc:m2:pos</ctag></lex>
    <lex><base>morski</base><ctag>adj:pl:nom:m3:pos</ctag></lex>
    <lex><base>morski</base><ctag>adj:pl:acc:m3:pos</ctag></lex>
    <lex><base>morski</base><ctag>adj:pl:voc:m3:pos</ctag></lex>
    <lex><base>morski</base><ctag>adj:pl:nom:f:pos</ctag></lex>
    <lex><base>morski</base><ctag>adj:pl:acc:f:pos</ctag></lex>
    <lex><base>morski</base><ctag>adj:pl:voc:f:pos</ctag></lex>
    <lex><base>morski</base><ctag>adj:pl:nom:n:pos</ctag></lex>
    <lex><base>morski</base><ctag>adj:pl:acc:n:pos</ctag></lex>
    <lex><base>morski</base><ctag>adj:pl:voc:n:pos</ctag></lex>
   </tok>
   <tok>
    <orth>(</orth>
    <lex><base>(</base><ctag>interp</ctag></lex>
   </tok>
   <ns/>
   <tok>
    <orth>na</orth>
    <lex><base>na</base><ctag>prep:acc</ctag></lex>
    <lex><base>na</base><ctag>prep:loc</ctag></lex>
   </tok>
   <tok>
    <orth>lądzie</orth>
    <lex><base>ląd</base><ctag>subst:sg:loc:m3</ctag></lex>
    <lex><base>ląd</base><ctag>subst:sg:voc:m3</ctag></lex>
   </tok>
   <tok>
    <orth>pojawiają</orth>
    <lex><base>pojawiać</base><ctag>fin:pl:ter:imperf</ctag></lex>
   </tok>
   <tok>
    <orth>się</orth>
    <lex><base>się</base><ctag>qub</ctag></lex>
   </tok>
   <tok>
    <orth>jedynie</orth>
    <lex><base>jedynie</base><ctag>adv:pos</ctag></lex>
   </tok>
   <tok>
    <orth>w</orth>
    <lex><base>w</base><ctag>prep:acc:nwok</ctag></lex>
    <lex><base>w</base><ctag>prep:loc:nwok</ctag></lex>
   </tok>
   <tok>
    <orth>strefie</orth>
    <lex><base>strefa</base><ctag>subst:sg:dat:f</ctag></lex>
    <lex><base>strefa</base><ctag>subst:sg:loc:f</ctag></lex>
   </tok>
   <tok>
    <orth>brzegowej</orth>
    <lex><base>brzegowy</base><ctag>adj:sg:gen:f:pos</ctag></lex>
    <lex><base>brzegowy</base><ctag>adj:sg:dat:f:pos</ctag></lex>
    <lex><base>brzegowy</base><ctag>adj:sg:loc:f:pos</ctag></lex>
   </tok>
   <ns/>
   <tok>
    <orth>)</orth>
    <lex><base>)</base><ctag>interp</ctag></lex>
   </tok>
   <tok>
    <orth>zamieszkujące</orth>
    <lex><base>zamieszkiwać</base><ctag>pact:sg:nom:n:imperf:aff</ctag></lex>
    <lex><base>zamieszkiwać</base><ctag>pact:sg:acc:n:imperf:aff</ctag></lex>
    <lex><base>zamieszkiwać</base><ctag>pact:sg:voc:n:imperf:aff</ctag></lex>
    <lex><base>zamieszkiwać</base><ctag>pact:pl:nom:m2:imperf:aff</ctag></lex>
    <lex><base>zamieszkiwać</base><ctag>pact:pl:acc:m2:imperf:aff</ctag></lex>
    <lex><base>zamieszkiwać</base><ctag>pact:pl:voc:m2:imperf:aff</ctag></lex>
    <lex><base>zamieszkiwać</base><ctag>pact:pl:nom:m3:imperf:aff</ctag></lex>
    <lex><base>zamieszkiwać</base><ctag>pact:pl:acc:m3:imperf:aff</ctag></lex>
    <lex><base>zamieszkiwać</base><ctag>pact:pl:voc:m3:imperf:aff</ctag></lex>
    <lex><base>zamieszkiwać</base><ctag>pact:pl:nom:f:imperf:aff</ctag></lex>
    <lex><base>zamieszkiwać</base><ctag>pact:pl:acc:f:imperf:aff</ctag></lex>
    <lex><base>zamieszkiwać</base><ctag>pact:pl:voc:f:imperf:aff</ctag></lex>
    <lex><base>zamieszkiwać</base><ctag>pact:pl:nom:n:imperf:aff</ctag></lex>
    <lex><base>zamieszkiwać</base><ctag>pact:pl:acc:n:imperf:aff</ctag></lex>
    <lex><base>zamieszkiwać</base><ctag>pact:pl:voc:n:imperf:aff</ctag></lex>
   </tok>
   <tok>
    <orth>zimne</orth>
    <lex><base>zimny</base><ctag>adj:sg:nom:n:pos</ctag></lex>
    <lex><base>zimny</base><ctag>adj:sg:acc:n:pos</ctag></lex>
    <lex><base>zimny</base><ctag>adj:sg:voc:n:pos</ctag></lex>
    <lex><base>zimny</base><ctag>adj:pl:nom:m2:pos</ctag></lex>
    <lex><base>zimny</base><ctag>adj:pl:acc:m2:pos</ctag></lex>
    <lex><base>zimny</base><ctag>adj:pl:voc:m2:pos</ctag></lex>
    <lex><base>zimny</base><ctag>adj:pl:nom:m3:pos</ctag></lex>
    <lex><base>zimny</base><ctag>adj:pl:acc:m3:pos</ctag></lex>
    <lex><base>zimny</base><ctag>adj:pl:voc:m3:pos</ctag></lex>
    <lex><base>zimny</base><ctag>adj:pl:nom:f:pos</ctag></lex>
    <lex><base>zimny</base><ctag>adj:pl:acc:f:pos</ctag></lex>
    <lex><base>zimny</base><ctag>adj:pl:voc:f:pos</ctag></lex>
    <lex><base>zimny</base><ctag>adj:pl:nom:n:pos</ctag></lex>
    <lex><base>zimny</base><ctag>adj:pl:acc:n:pos</ctag></lex>
    <lex><base>zimny</base><ctag>adj:pl:voc:n:pos</ctag></lex>
   </tok>
   <tok>
    <orth>morza</orth>
    <lex><base>morze</base><ctag>subst:sg:gen:n</ctag></lex>
    <lex><base>morze</base><ctag>subst:pl:nom:n</ctag></lex>
    <lex><base>morze</base><ctag>subst:pl:acc:n</ctag></lex>
    <lex><base>morze</base><ctag>subst:pl:voc:n</ctag></lex>
   </tok>
   <tok>
    <orth>półkuli</orth>
    <lex><base>półkula</base><ctag>subst:sg:gen:f</ctag></lex>
    <lex><base>półkula</base><ctag>subst:sg:dat:f</ctag></lex>
    <lex><base>półkula</base><ctag>subst:sg:loc:f</ctag></lex>
   </tok>
   <tok>
    <orth>południowej</orth>
    <lex><base>południowy</base><ctag>adj:sg:gen:f:pos</ctag></lex>
    <lex><base>południowy</base><ctag>adj:sg:dat:f:pos</ctag></lex>
    <lex><base>południowy</base><ctag>adj:sg:loc:f:pos</ctag></lex>
   </tok>
   <ns/>
   <tok>
    <orth>.</orth>
    <lex><base>.</base><ctag>interp</ctag></lex>
   </tok>
  </chunk>
 </chunk>
</chunkList>
</cesAna>
