<?xml version="1.0" encoding="UTF-8"?>
<!DOCTYPE cesAna SYSTEM "xcesAnaIPI.dtd">
<cesAna xmlns:xlink="http://www.w3.org/1999/xlink" version="1.0" type="lex disamb">
<chunkList>
 <chunk>
  <chunk type="s">
   <tok>
    <orth>Na</orth>
    <lex><base>na</base><ctag>prep:loc</ctag></lex>
   </tok>
   <tok>
    <orth>starym</orth>
    <lex><base>stary</base><ctag>adj:sg:loc:m3:pos</ctag></lex>
   </tok>
   <tok>
    <orth>stole</orth>
   <lex><base>stół</base><ctag>subst:sg:loc:m3</ctag></lex>
   </tok>
  </chunk>
 </chunk>
</chunkList>
</cesAna>
