<?xml version="1.0" encoding="UTF-8"?>
<!DOCTYPE cesAna SYSTEM "xcesAnaIPI.dtd">
<cesAna xmlns:xlink="http://www.w3.org/1999/xlink" version="1.0" type="lex disamb">
<chunkList>
 <chunk id="ch1" type="p">
  <sentence>
   <tok>
    <orth>Na</orth>
    <lex><base>na</base><ctag>prep:acc</ctag></lex>
    <lex><base>na</base><ctag>prep:loc</ctag></lex>
    <ann chan="NP">0</ann>
   </tok>
   <tok>
    <orth>starym</orth>
    <lex><base>stary</base><ctag>adj:pl:dat:f:pos</ctag></lex>
    <lex><base>stary</base><ctag>adj:pl:dat:m1:pos</ctag></lex>
    <lex><base>stary</base><ctag>adj:pl:dat:m2:pos</ctag></lex>
    <lex><base>stary</base><ctag>adj:pl:dat:m3:pos</ctag></lex>
    <lex><base>stary</base><ctag>adj:pl:dat:n:pos</ctag></lex>
    <lex><base>stary</base><ctag>adj:sg:inst:m1:pos</ctag></lex>
    <lex><base>stary</base><ctag>adj:sg:loc:m1:pos</ctag></lex>
    <lex><base>stary</base><ctag>adj:sg:inst:m2:pos</ctag></lex>
    <lex><base>stary</base><ctag>adj:sg:loc:m2:pos</ctag></lex>
    <lex><base>stary</base><ctag>adj:sg:inst:m3:pos</ctag></lex>
    <lex><base>stary</base><ctag>adj:sg:loc:m3:pos</ctag></lex>
    <lex><base>stary</base><ctag>adj:sg:inst:n:pos</ctag></lex>
    <lex><base>stary</base><ctag>adj:sg:loc:n:pos</ctag></lex>
    <lex><base>stara</base><ctag>subst:pl:dat:f</ctag></lex>
    <ann chan="NP" head="1">1</ann>
   </tok>
   <tok>
    <orth>stole</orth>
    <lex><base>stola</base><ctag>subst:pl:acc:f</ctag></lex>
    <lex><base>stola</base><ctag>subst:pl:nom:f</ctag></lex>
    <lex><base>stola</base><ctag>subst:pl:voc:f</ctag></lex>
    <lex><base>stół</base><ctag>subst:sg:loc:m3</ctag></lex>
    <lex><base>stół</base><ctag>subst:sg:voc:m3</ctag></lex>
    <ann chan="NP">1</ann>
   </tok>
   <tok>
    <orth>pod</orth>
    <lex><base>pod</base><ctag>prep:acc:nwok</ctag></lex>
    <lex><base>pod</base><ctag>prep:gen:nwok</ctag></lex>
    <lex><base>pod</base><ctag>prep:inst:nwok</ctag></lex>
    <ann chan="NP">0</ann>
   </tok>
   <tok>
    <orth>starym</orth>
    <lex><base>stary</base><ctag>adj:pl:dat:f:pos</ctag></lex>
    <lex><base>stary</base><ctag>adj:pl:dat:m1:pos</ctag></lex>
    <lex><base>stary</base><ctag>adj:pl:dat:m2:pos</ctag></lex>
    <lex><base>stary</base><ctag>adj:pl:dat:m3:pos</ctag></lex>
    <lex><base>stary</base><ctag>adj:pl:dat:n:pos</ctag></lex>
    <lex><base>stary</base><ctag>adj:sg:inst:m1:pos</ctag></lex>
    <lex><base>stary</base><ctag>adj:sg:loc:m1:pos</ctag></lex>
    <lex><base>stary</base><ctag>adj:sg:inst:m2:pos</ctag></lex>
    <lex><base>stary</base><ctag>adj:sg:loc:m2:pos</ctag></lex>
    <lex><base>stary</base><ctag>adj:sg:inst:m3:pos</ctag></lex>
    <lex><base>stary</base><ctag>adj:sg:loc:m3:pos</ctag></lex>
    <lex><base>stary</base><ctag>adj:sg:inst:n:pos</ctag></lex>
    <lex><base>stary</base><ctag>adj:sg:loc:n:pos</ctag></lex>
    <lex><base>stara</base><ctag>subst:pl:dat:f</ctag></lex>
    <ann chan="NP" head="1">2</ann>
   </tok>
   <tok>
    <orth>sufitem</orth>
    <lex><base>sufit</base><ctag>subst:sg:inst:m3</ctag></lex>
    <ann chan="NP">2</ann>
   </tok>
   <tok>
    <orth>pies</orth>
    <lex><base>pies</base><ctag>subst:sg:nom:m2</ctag></lex>
    <ann chan="NP" head="1">3</ann>
   </tok>
   <tok>
    <orth>stał</orth>
    <lex><base>stać</base><ctag>praet:sg:m1:imperf</ctag></lex>
    <lex><base>stać</base><ctag>praet:sg:m2:imperf</ctag></lex>
    <lex><base>stać</base><ctag>praet:sg:m3:imperf</ctag></lex>
    <lex><base>stać</base><ctag>praet:sg:m1:perf</ctag></lex>
    <lex><base>stać</base><ctag>praet:sg:m2:perf</ctag></lex>
    <lex><base>stać</base><ctag>praet:sg:m3:perf</ctag></lex>
    <ann chan="NP">0</ann>
   </tok>
   <ns/>
   <tok>
    <orth>.</orth>
    <lex><base>.</base><ctag>interp</ctag></lex>
    <ann chan="NP">0</ann>
   </tok>
  </sentence>
 </chunk>
</chunkList>
</cesAna>
