<?xml version="1.0" encoding="UTF-8"?>
<!DOCTYPE cesAna SYSTEM "xcesAnaIPI.dtd">
<cesAna xmlns:xlink="http://www.w3.org/1999/xlink" version="1.0" type="lex disamb">
<chunkList>
 <chunk>
  <chunk type="s">
   <tok>
    <orth>Nasze</orth>
    <lex><base>nasz</base><ctag>adj:sg:nom:n:pos</ctag></lex>
    <lex><base>nasz</base><ctag>adj:sg:acc:n:pos</ctag></lex>
    <lex><base>nasz</base><ctag>adj:sg:voc:n:pos</ctag></lex>
    <lex><base>nasz</base><ctag>adj:pl:nom:m2:pos</ctag></lex>
    <lex><base>nasz</base><ctag>adj:pl:acc:m2:pos</ctag></lex>
    <lex><base>nasz</base><ctag>adj:pl:voc:m2:pos</ctag></lex>
    <lex><base>nasz</base><ctag>adj:pl:nom:m3:pos</ctag></lex>
    <lex><base>nasz</base><ctag>adj:pl:acc:m3:pos</ctag></lex>
    <lex><base>nasz</base><ctag>adj:pl:voc:m3:pos</ctag></lex>
    <lex><base>nasz</base><ctag>adj:pl:nom:f:pos</ctag></lex>
    <lex><base>nasz</base><ctag>adj:pl:acc:f:pos</ctag></lex>
    <lex><base>nasz</base><ctag>adj:pl:voc:f:pos</ctag></lex>
    <lex><base>nasz</base><ctag>adj:pl:nom:n:pos</ctag></lex>
    <lex><base>nasz</base><ctag>adj:pl:acc:n:pos</ctag></lex>
    <lex><base>nasz</base><ctag>adj:pl:voc:n:pos</ctag></lex>
   </tok>
   <tok>
    <orth>nadzieje</orth>
    <lex><base>nadziać</base><ctag>fin:sg:ter:perf</ctag></lex>
    <lex><base>nadzieja</base><ctag>subst:pl:nom:f</ctag></lex>
    <lex><base>nadzieja</base><ctag>subst:pl:acc:f</ctag></lex>
    <lex><base>nadzieja</base><ctag>subst:pl:voc:f</ctag></lex>
   </tok>
   <tok>
    <orth>wspaniałe</orth>
    <lex><base>wspaniały</base><ctag>adj:sg:nom:n:pos</ctag></lex>
    <lex><base>wspaniały</base><ctag>adj:sg:acc:n:pos</ctag></lex>
    <lex><base>wspaniały</base><ctag>adj:sg:voc:n:pos</ctag></lex>
    <lex><base>wspaniały</base><ctag>adj:pl:nom:m2:pos</ctag></lex>
    <lex><base>wspaniały</base><ctag>adj:pl:acc:m2:pos</ctag></lex>
    <lex><base>wspaniały</base><ctag>adj:pl:voc:m2:pos</ctag></lex>
    <lex><base>wspaniały</base><ctag>adj:pl:nom:m3:pos</ctag></lex>
    <lex><base>wspaniały</base><ctag>adj:pl:acc:m3:pos</ctag></lex>
    <lex><base>wspaniały</base><ctag>adj:pl:voc:m3:pos</ctag></lex>
    <lex><base>wspaniały</base><ctag>adj:pl:nom:f:pos</ctag></lex>
    <lex><base>wspaniały</base><ctag>adj:pl:acc:f:pos</ctag></lex>
    <lex><base>wspaniały</base><ctag>adj:pl:voc:f:pos</ctag></lex>
    <lex><base>wspaniały</base><ctag>adj:pl:nom:n:pos</ctag></lex>
    <lex><base>wspaniały</base><ctag>adj:pl:acc:n:pos</ctag></lex>
    <lex><base>wspaniały</base><ctag>adj:pl:voc:n:pos</ctag></lex>
   </tok>
   <ns/>
   <tok>
    <orth>;</orth>
    <lex><base>;</base><ctag>interp</ctag></lex>
   </tok>
   <tok>
    <orth>ona</orth>
    <lex><base>on</base><ctag>ppron3:sg:nom:f:ter</ctag></lex>
   </tok>
   <tok>
    <orth>nadzieje</orth>
    <lex><base>nadziać</base><ctag>fin:sg:ter:perf</ctag></lex>
    <lex><base>nadzieja</base><ctag>subst:pl:nom:f</ctag></lex>
    <lex><base>nadzieja</base><ctag>subst:pl:acc:f</ctag></lex>
    <lex><base>nadzieja</base><ctag>subst:pl:voc:f</ctag></lex>
   </tok>
   <tok>
    <orth>pierwsza</orth>
    <lex><base>pierwsza</base><ctag>subst:sg:nom:f</ctag></lex>
    <lex><base>pierwszy</base><ctag>adj:sg:nom:f:pos</ctag></lex>
    <lex><base>pierwszy</base><ctag>adj:sg:voc:f:pos</ctag></lex>
   </tok>
   <ns/>
   <tok>
    <orth>;</orth>
    <lex><base>;</base><ctag>interp</ctag></lex>
   </tok>
   <tok>
    <orth>oni</orth>
    <lex><base>on</base><ctag>ppron3:pl:nom:m1:ter</ctag></lex>
   </tok>
   <tok>
    <orth>nadzieje</orth>
    <lex><base>nadziać</base><ctag>fin:sg:ter:perf</ctag></lex>
    <lex><base>nadzieja</base><ctag>subst:pl:nom:f</ctag></lex>
    <lex><base>nadzieja</base><ctag>subst:pl:acc:f</ctag></lex>
    <lex><base>nadzieja</base><ctag>subst:pl:voc:f</ctag></lex>
   </tok>
   <tok>
    <orth>pierwsi</orth>
    <lex><base>pierwszy</base><ctag>adj:pl:nom:m1:pos</ctag></lex>
    <lex><base>pierwszy</base><ctag>adj:pl:voc:m1:pos</ctag></lex>
   </tok>
  </chunk>
 </chunk>
</chunkList>
</cesAna>
