<?xml version="1.0" encoding="utf-8"?><!DOCTYPE cesAna SYSTEM "xcesAnaIPI.dtd"><cesAna type="pre_morph" version="PWR 0.1" xmlns:xlink="http://www.w3.org/1999/xlink"><chunkList xml:base="text.xml">
<chunk type="p" xlink:href="#dv1p0">Chrostowski nie dostrzega przejawów dobrej woli, także po stronie żydowskiej.</chunk>
<chunk type="p" xlink:href="#dv1p1">Zrazu delikatnie - gdy ludzie mijają się na klatce schodowej, oprócz rytualnego "dzień dobry" wymieniają uwagi o brzydkim zapachu.</chunk>
<chunk type="p" xlink:href="#dv1p1">Zrazu delikatnie - gdy ludzie mijają się na klatce schodowej, oprócz rytualnego "dobry dzień" wymieniają uwagi o brzydkim zapachu.</chunk>
<chunk type="p" xlink:href="#dv1p1">Projekt rozporządzenia Ministra Edukacji Narodowej w sprawie podstaw programowych kształcenia w zawodach: górnik eksploatacji podziemnej, górnik odkrywkowej eksploatacji złóż, monter instalacji gazowych, monter instrumentów całkowicie muzycznych, monter sieci komunalnych, stolarz, technik hydrolog, technik instrumentów muzycznych, technik meteorolog i technik papiernictwa Projekt rozporządzenia Ministra Edukacji Narodowej w sprawie sposobu i trybu organizowania indywidualnego obowiązkowego rocznego przygotowania przedszkolnego i indywidualnego nauczania dzieci i młodzieży Projekt rozporządzenia Ministra Edukacji Narodowej w sprawie rodzajów innych form wychowania przedszkolnego, warunków tworzenia i organizowania tych form oraz sposobu ich działania Projekt rozporządzenia Ministra Edukacji Narodowej w sprawie rodzajów innych form wychowania przedszkolnego, warunków tworzenia i organizowania tych form oraz sposobu ich działania.</chunk>
<chunk type="p" xlink:href="#dv1p1">Pozycja, mimo iż dotyczy trudnych zagadnień, zawiera jasne i klarowne pytania, zrozumiałe dla wszystkich tych, którzy zajmują się immunologią z racji studiów, pracy nie całkiem naukowej czy zawodowej.</chunk>
<chunk type="p" xlink:href="#dv1p1">Pozycja, mimo iż dotyczy trudnych zagadnień, zawiera jasne i klarowne pytania, zrozumiałe dla wszystkich tych, którzy zajmują się immunologią z racji studiów, naukowej nie całkiem pracy czy zawodowej.</chunk>
<chunk type="p" xlink:href="#dv1p1">Pozycja, mimo iż dotyczy trudnych zagadnień, zawiera jasne i klarowne pytania, zrozumiałe dla wszystkich tych, którzy zajmują się immunologią z racji studiów, pracy z natury naukowej czy zawodowej.</chunk>
<chunk type="p" xlink:href="#dv1p1">Pozycja, mimo iż dotyczy trudnych zagadnień, zawiera jasne i klarowne pytania, zrozumiałe dla wszystkich tych, którzy zajmują się immunologią z racji studiów, naukowej z natury nie całkiem pracy czy zawodowej.</chunk>
</chunkList></cesAna>
